product_code;nombre ;nombre largo ;detalle ;familia ;clase;Costo;lista 
COTOK20-N;Cocina Electrica Tokyo 2Placa;Cocina Electrica Tokyo 2Placas Mod Tok20 1500 750W;2 Placas . 5 Niveles De Potencia . Luz Piloto . Indicador De Encendido Y Apagado . Termostato Automatico . Ideal Para Todo Tipo De Coccion . Potencia 1500 W - 750 W;15;15004;220028;278000
GCVM6D;Cocina Maxi 6H Venancio M6D;Cocina Maxi 6Hornallas Venancio Mod M6D;Tipo: A Gas  . Material: Acero  . Quemadores: En Hierro Fundido . Cantidad De Hornallas: 6;36;36001;5660000;7132000
GCP-PM200;Cocina Progas 2H Pm-200;Cocina Progas 2Hornallas Mod Pm 200;Estructura En Hierro Fundido Con Acabado En Pintura Negra Epoxi .  Rejillas De Hierro Fundido . Perfil 3 Cm Y Rejilla En Hierro Fundido 30 X 30 Cm .  Bandeja Para Juntar La Grasa .  Disponible En Baja Presion .  Llama Simple . Profundidad:400 Mm . Largo:700 Mm . Quemadores:2;36;36001;950000;1197000
GCOPG-PMS400;Cocina Progas Pms-400 4H;Cocina Progas Mod Pms 400 4H 30*30Cm Sin Horno;Cocina Industrial 4 Hornallas Sin Horno4 Hornallas De 30X30 CmsQuemadores De 12Mm De DiametroHornallas En Hierro FundidoFabricado En Chapa De Acero Con Pintura EpoxiEstructura Desmontable;36;36001;1750000;2205000
COVO85852P;Cocina Volcan 85852P Acer Inox;Cocina Volcan Mod 85852P Acero Inoxidable;Ancho 63 Cm . Alto 90 Cm . Largo 60 Cm . Peso 45000 Gr;15;15006;3749990;4725000
COWFD5NARRUW;Cocina Whirlpool 5H Inx Dobhor;Cocina Whirlpool Wfd5Narruw 5H Inox Doble Horno;Doble Horno . Horno Cleartch . Vidrio Easy Open . Perillas Removibles . Rejillas Robustas;15;15006;4680017;5897000
COWFS5NARUUW;Cocina Whirlpool 5H Inox;Cocina Whirlpool Wfs5Naruuw 5H Inox;Alxanxprof: 97,6 X 77,8 X 68,1 Cm . Horno Cleartech .  Vidrio Facil De Abrir .  Perillas Removibles .  Rejillas Robustas . Encendido Electrico: Si . Color: Acero Inoxidable . Cantidad De Quemadores: 5;15;15006;3119989;3932000
GCEMC4PCG;Congelador Ecosilkon Mc4Pcg 4P;Congelador Ecosilkon Mod Mc4Pcg 4Ptas Temp  15Nc 800Lts 220V/50Hz;Congelador Ecosilkon Mod Mc4Pcg  . 4Ptas Temp -15Nc  . 800Lts 220V 50Hz;36;36001;19600000;24696000
CGTCONP400;Congelador Helados Tokyo Np400;Congelador P/Helados Tokyo Mod Tconp400 333 Net 2T/Vid Desliz;Tapa Corrediza . 7 Niveles De Temperatura . Perilla Encendido Apagado . Regulador De Temp . Clase Climatica  . Con Canastilla . Luz Indicadora . Funciones . Refrigerador . Mantenedor . Congelador . Interior Recubierto De Epoxi . Gas Ecologico . Con Llave Y Cerradura . Rueditas ;5;5002;3496998;4407000
CGTCONH220R;Congelador Helados Tokyo H220R;Congelador P/Helados Tokyo Tconh220R 132 Net VidCurvo Desliz;Con 2 Tapas Corredizas De Vidrio Curvo . Con Perilla De Regulacion . Funcion Refrigerador (Heladera) Y Congelador . Frio Humedo Tropicalizado . 7 Niveles De Temperatura . Interior De Epoxi . Llave Y Cerradura . Ruedas . Ancho 61 Cm . Alto: 90 Cm . Prof: 65 Cm;5;5002;2162492;2725000
CGTCONH350R;Congelador Helados Tokyo H350R;Congelador P/Helados Tokyo Tconh350R 263 Net 2T/VidCurvo Desliz;Capacidad 263 Lts . 2Tapas Vidrio Curvo Deslizable . 7 Niveles De Temperatura . Gas Ecologico . Perilla De Regulacion: Funcion Refrigerador Y Congelador . Canastilla . Con Llave Y Cerradura . Rueditas . Congelador Para Helados;5;5002;3445006;4341000
CGTOK157L;Congelador Tokyo Vert F C 157L;Congelador Tokyo Vertical Frio Humedo 5 Cajones Neto 157 Lts 220V;Capacidad: 157 Litros .  3 Niveles De Temperatura .  6 Cajones Internos Individuales .  Con Puerta Reversible . R600A Gas Eco;5;5002;2403491;3029000
CGWVG28HKDWX;Congelador Vert Whirlpool 280L;Congelador Vertical Whirlpool Wvg28Hk 280L Evox Frio Seco;Este Congelador Cuenta Con Funcion De Congelado Rapido Que Acelera El Enfriamiento Y Conserva Mejor Tus Alimentos, Ademas De Multiples Compartimientos Para Lograr Una optima Organizacion;5;5002;4252356;5358000
EDPCM2001;Cortacesped Trapp Master 2001;Cortacesped Manual Trapp Master 2001;3 Alturas De Corte . Cabo Plegable  . Franja De Corte De 38 Cm . Sistema De Laminas De Corte Rotativas (Autoafilables);35;35011;476705;601000
EDPCLF600G;Cortacesped Trapp Lf-600g;Cortacesped Trapp Lf 600G Naftero 65Hp S/ Bolsa;"Puede Ser Usado En Terrenos Accidentados Con Inclinacion Hasta 15  Por Tiempo Indeterminado Y En 30 Para Movimientos Intermitentes; . Mango Ergonomico Para Mayor Comodidad Del Operador, Plegable Que Facilita El Transporte Y  Almacenamiento; . Base En Chapa De Acero De 1,9Mm De Espesura Ruedas De Polietileno De Alta Densidad Revestidas Con Neumaticos De Pvc; . Consumo De Combustible Aprox 1 Litro H; . Lubricante Aceite Sae 20W50; . Lamina En Acero Especial De 3Mm De Espesura, Templado Por Induccion En La Lamina De Corte; . Realizar El 1  Cambio De Aceite, Despues De Las Primeras 5 Horas De Trabajo Y Las Otras Despues De 25 Horas De Servicio, Con Mantenimiento Del Filtro De Aire; . Salida Lateral;";35;35011;2245103;2829000
EDPCLF80G;Cortacesped Trapp Lf-80G Naft;Cortacesped Trapp Lf 80G Naftero 35Hp S/ Bolsa;Potencia: 3,5 Hp . Rango De Corte: 48 Cm . Regulacion De Altura: 5 Posiciones . Mango Ergonomico Y Plegable . Rendimento Aproximado De 800Mý H . Chasis De Metal;35;35011;2065610;2603000
EDPCLF80RM;Cortacesped Trapp Lf-80Rm Naft;Cortacesped Trapp Lf 80Rm Naftero 35Hp S/ Bolsa;3,5 Hp . 48 Cm De Corte . Salida Lateral . Ruedas Traseras Mas Grandes Que Permiten Un Mejor Desplazamiento;35;35011;2192039;2762000
EDPCLF90G;Cortacesped Trapp Lf-90G Naft;Cortacesped Trapp Lf 90G Naftero 35 Hp C/Bolsa;Con Este Cortacesped Podras Tener El Jardin Que Siempre Sonhaste  . Equipado Con Ahogador Manual Y Valvula De Combustible Para Facilitar El Arranque Del Motor  . Cuenta Con Chasis De Metal Y Tratamiento Anticorrosivo En Todas Las Piezas Para Mayor Durabilidad  . Recomendado Para Realizar Cortes De areas Medianos Y Mayores Que 800M;35;35011;2350427;2962000
EDPCMB51E;Cortacesped Trapp Mb-51E Elect;Cortacesped Trapp Mb 51E Electrico 2500W C/ Bolsa;Cortadora De Cesped Electrica Adecuada Para El Corte Y La Recoleccion De Pastos En Las Zonas Medianas Y Grandes  . Productos De ultima Generacion, Eficiente Y Segura  . Sistemas De Arranque Manual Y Aceleracion  . Ruedas Recubierto De Neumaticos De Caucho  . 9 Alturas De Corte  . Gama De Corte De 51 Cm  . Hoja De Acero Con La Induccion De Endurecimiento De La Vanguardia  . Tratamiento Anticorrosivo En Todas Las Partes;35;35011;2743784;3458000
EDPC1HP;Cortacesped Trapp Mc40L Elect;Cortacesped Trapp Mc40L Electrico 1300W C/ Bolsa;1 Hp De Potencia . Faja De Corte De 35 Cm . Incluye Bolsa . 5 Niveles De Corte . 1300 W . 3600 Rpm . Ruedas De Polietileno De Alta Densidad Revestida Con Pvc;35;35011;1499527;1890000
EDPC50E;Cortacesped Trapp Mc-50E Elect;Cortacesped Trapp Mc 50E Electrico 2500W S/ Bolsa;2500W . Salida Lateral . 5 Posiciones De Corte . 48 Cm De Corte . 20 Mts De Cable . Monofasico;35;35011;2029698;2558000
EDPC60E;Cortacesped Trapp Mc-60E Elect;Cortacesped Trapp Mc 60E Electrico 2500W C/ Bolsa;Cortadora De Cesped Electrica Adecuada Para El Corte Y La Recoleccion De Hierbas En Los Huertos Familiares, Parques, Campos De Futbol Y Otros . Productos De ultima Generacion, Eficiente Y Segura . 5 Alturas De Corte . Ruedas Recubiertas Con Neumaticos De PvcHoja De Acero Con La Induccion De Endurecimiento De La Vanguardia . Establecer Para La Fijacion De La Cuchilla De Corte Muy Resistente;35;35011;2335888;2944000
EDPCSL30S1050;Cortacesped Trapp Sl30S Elect;Cortacesped Trapp Sl30S Electrico 1050W S/ Bolsa;Funcionamiento Electrico .  1050W .  Sin Bolsa .  Medida De Corte De 30 Cm .  3 Niveles De Corte .  3600 Rpm .  Motor Weg .  10 Mts De Cable;35;35011;1038098;1309000
EDPCSL350;Cortacesped Trapp Sl350 Elect;Cortacesped Trapp Sl350 Electrico 1300W S/ Bolsa;Ancho 435 Cm . Alto 30 Cm . Largo 655 Cm . Peso 20515 Gr;35;35011;1294306;1631000
EDPWM350;Cortacesped Trapp Wm350 Elect;Cortacesped Trapp Wm350 Electrico 1300W C/ Recolector;1 Hp . Funcionamiento Electrico . Carcaza Totalmente De Polipropileno . 3 Alturas De Corte . Facil Montaje Y Limpieza . Base Termoplastica . Ruedas De Polipropileno . Con Recolector Rigido . Medida De Corte 33 Cms . Altura Ajustable En 3 Niveles;35;35011;1153539;1454000
GCMM-529;Cortador Manual Malta-Mod529;Cortador Manual Malta Mod529 De Papas Legumbres Y Frutas 10X10Mm;Ancho 255 Cm . Alto 43 Cm . Largo 18 Cm . Peso 195900 Gr;36;36001;358300;452000
EDTCA10Y2S;Cortina de Aire Tokyo Fm3010;Cortina De Aire Tokyo Con Control Mod Fm3010 Y 2 S 1 M;Marca Tokyo . Segmento . Peso: 14600 Gr . Ancho: 225 Cm . Alto: 25 Cm . Largo: 105 Cm;25;25006;624038;787000
EDTCA12Y2S;Cortina de Aire Tokyo Fm3012;Cortina De Aire Tokyo Con Control Mod Fm3012 Y 2 S 12M;Disenho Compacto .  Ahorro De Espaciocarcasa Metalica  . Instalacion Simple Y Facil Limpiezaturbina De Plastico Rigido  . Bajo Nivel De Ruidoventilador Optimizado Para Gran Volumen De Aire Y Estabilidad2 Velocidades  . Doble Metodo De Control Manual;25;25006;797568;1005000
EDTCA15Y2S;Cortina De Aire Tokyo Fm3015;Cortina De Aire Tokyo Con Control Mod Fm3015 Y 2 S 15M;Disenho Compacto, Ahorro De Espaciocarcasa Metalica, Instalacion Simple Y Facil Limpiezaturbina De Plastico Rigido, Bajo Nivel De Ruidoventilador Optimizado Para Gran Volumen De Aire Y Estabilidad2 Velocidades, Doble Metodo De Control Manual . Ancho 25 Cm . Alto 23 Cm . Largo 155 Cm . Peso 202 Kg;25;25006;980411;1236000
EDTCA20Y2S;Cortina De Aire Tokyo Fm3020;Cortina De Aire Tokyo Con Control Mod Fm3020 Y 2 S 2 M;Ideal Para Puertas Con Aberturas Permanentes .  2 Velocidades .  Con Carcasa Metalica .  Con Soporte Para Instalacion .  2 Modos De Manejo: Manual Y A Control Remoto  . Largo: 200Cm (2 M);25;25006;1414437;1783000
GEMT-EL10;Embutidora Chorizo Metvisa 10K;Embutidora De Chorizo Metvisa 10 Kg  El 10;Embutidora De Chorizo  . Metvisa 10 Kg- El-10;36;36001;2050000;2583000
EDTCSFOGO;Encendedor De Carbon Tokyo;Encendedor De Carbon Tokyo Para Cocina De Uso Domestico;Agiliza El Encendido Del Carbon Para El Asado . Encendedor De Carbon Tokyo Para Cocina Uso Domestico Edtcsfogo . Potencia 450W . Temperatura: 350 C  . Proporciona Segurida Y Practicidad Con Ek Rapido Encendido Del Carbon;15;15007;79998;101000
EEVSYM-SILVER;Enfriador Evap Symphony Silver;Enfriador Evaporativo Symphony Mod Silver S/Control;El Sistema De Enfriamiento Por Aire Evaporativo Silver Es Una Forma Inteligente Y Elegante De Obtener Aire Fresco De Forma Natural Disenhado Para Integrarse Perfectamente En Cualquier Espacio Interior, Este Acondicionador De Aire Evaporativo Incluye Una Serie De Caracteristicas Que Hacen Que Su Vida Sea Mas Saludable Y Mas Comoda;25;25003;698810;881000
EEVSYM-HCSI;Enfriador Evap Symphony New Hi;Enfriador Evaporativo Symphony New Hi Cool Smart I Con Control Remoto;Caudal De Aire 1200 M H  .  Area De Cobertura 28 Metros Cuadrados  . 175W  . Capacidad Del Tanque De Agua 25 Litros  . 3 Velocidades  . Oscilador Automatico .  Deposito Para Hielo  . Panel Digital  . Timer Hasta 7 Horas  .  Control De Humedad  . Bomba Especial Dura Pump Que Se Desactiva Al Estar El Tanque Vacio  .  Alarma Que Indica Cuando El Tanque Esta Vacio  .  Medidas Del Producto Ancho 50 Cm Alto 90 Cm Profundidad 31 Cm;25;25003;1164661;1468000
EDXEJU550D-N;Extractor Jugo Moulinex  800W;Extractor De Jugo Moulinex Ju550D10 800W;Potencia 800W . Filtro De Acero Inox, Con 2 Cuchillas Centrales Para Un Corte Optimo . Accesorios: Colector De Pulpa, Jarra, Tapa, Empujador Y Filtro . Accesorios Apto Para Lavavajillas;1;1003;670000;845000
EDTEFMAX2-N;Extractor De Jugos Tokyo Fruit;Extractor De Jugos Tokyo Fruit Max 600W 2 Veloc Cap Para Pulpa 15L;Extractor De Jugos Tokyo Fruit Max 600W 2 Veloc Cap Para Pulpa 15L;1;1003;260965;329000
GFHE-ZBP22;Fabricador Hielo Ecosilkon Bal;Fabricadora De Hielo Ecosilkon Bala Md Zbp22 13/22Kg/24H Cap Deposito 7K Inx Fil;Fabricadora De Hielo  . Ecosilkon Bala  . Md Zbp22 13 22Kg 24H  . Cap Deposito 7K Inx Fil;36;36001;4275000;5387000
GFHE-ZBL90;Fabricador Hielo Ecosilkon Zbl;Fabricadora De Hielo Ecosilkon Mod Zbl9 40/90Kg/24H Cap Deposito 48Kg Ac Inox Fi;Fabricadora De Hielo  . Ecosilkon Mod Zbl9  . 40 90Kg 24H  . Cap Deposito 48Kg Ac Inox Fi;36;36001;9255000;11662000
EDPTRITRF30;Forrajera Trapp Trf-300;Forrajera Trapp Trf 300 2Hp C/ Correa;2 Hp . 10 Martillos Moviles . 2 Cuchillas . Produccion Forraje: 700 1400 Kg H . Produccion Maiz: 50 80 Kg H . Tratamiento Anticorrosivo En Todas Las Piezas;35;35012;3699070;4661000
EDPTRF400;Forrajera Trapp Trf-400 ;Forrajera Trapp Trf 400 2Hp;2 Hp . 3600 Rpm . Monofasico .  2 Cuchillas Y 10 Martillos Moviles . Produccion 800 1200 Kg H .  Interruptor De  EnconApag ;35;35012;2896879;3651000
GFRPG-PR310G;Freidora A Gas Progas Pr-310G;Freidora A Gas Progas Pr 310G;Estructura De Acero Inoxidable . Con Cesta Incluida . Kit De Gas De Alta Presion . Patas Estabilizadoras . Altura:250 Mm . Profundidad:400 Mm . Largo:320 Mm;36;36001;395000;498000
GFRMT-TFE6;Freidora Elect Metvisa Tfe-6;Freidora Electrica Metvisa Tfe 6;Exterior En Acero Inoxidable .  Bajo Consumo De Energia .  Pies Estabilizadores  .  Canasto En Acero Inoxidable . Capacidad: 6 Lts;36;36001;885000;1116000
GFRPG-PR310E;Freidora Electr Progas- Pr310E;Freidora Electrica Progas  Pr 310E 1 Can 35 Ltrs;La Freidora Electrica Pr-310 E De Progas De 3 De Litros, Es Ideal Para Uso En Diversos Establecimientos Comerciales, Indicada Para Uso Profesional En La Fritura De Diversos Alimentos . Practica Y De Facil Manejo . Estructura En Acero Inoxidable . Resistencia En Acero Inoxidable . Termostato Para Control De Temperatura Automatico . area De Fritura: Diametro 285Mm . Con Cesta Incluida . Capacidad: 0,5 Kg Cesto;36;36001;880000;1109000
GFRPG-PR70E;Freidora Electr Progas Pr-70E;Freidora Electrica Progas Pr 70E;Freidora Electrica Pr-70E De Progas, Posee Una Capacidad De 7 Litros, Resistencia Y Estructura De Acero Inoxidable Potencia De 2500 W, Consumo De 35 Kwh Dimensiones: Altura De 025, Profundidad De 040, Ancho De 040 Metros Y Peso De 35 Kg;36;36001;950000;1197000
GFT-EF17;Freidora Electr Tokyo Ind 10L;Freidora Electrica Tokyo Industrial 10Lts 3000W Ef 17L; Capacidad 10 Lts .  Termostato Regulable  . 1 Canasta . Totalmente En Acero Inox ;36;36001;1242300;1566000
EDXFMFR33-N;Freidora Moulinex Easy Am33807;Freidora Moulinex Easy Pro 3L Mod Am338070;Ajuste De Termostato . Base Antideslizante . Zona Fria: Los Restos No Se Queman, El Aceite Dura Mas . Tazon Extraible De Acero Inoxidable Ultra Resistente . Totalmente Desmontable Y Apto Para Lavavajillas . Ventana De Vision Que Permite Controlar El Nivel De Fritura Y Obtener Resultados Perfectos . Capacidad Aceite De 3 Litros . Potencia De 2200W;1;1002;649029;818000
HEWHWRA08BVDWX;Frigobar Whirlpool Vintage 80L;Frigobar Whirlpool Vintage Wra08Bvd Rojo 80L Frio Humedo + Adaptador;Frigobar Whirlpool Vintage  . Modelo: Wra08Bvd  . Color: Rojo  . 80L Frio Humedo + Adaptador . Ancho 51 Cm . Alto 65 Cm . Largo 56 Cm . Peso 29000 Gr;5;5001;2608444;3287000
HEWHWRA12BKDWX;Frigobar Whirlpool 120L F H;Frigobar Whirlpool Wra12Bkdwx 120L Evox Frio Humedo;Ancho 482 Cm . Alto 862 Cm . Largo 519 Cm . Peso 28 Kg;5;5001;2315185;2918000
EDPFSX-LK16;Fumigador Mochila Trapp 16L;Fumigador Pulverizador Mochila Trapp Mod Sx Lk16 16 Lts;4 Tipos De Boquilla: Ducha, Abanico, Cono Y Doble Cono . Reversible: Puede Ser Utilizado Por Diestros Y Zurdos . Tapa Con Valvula Anti-Goteo . Recipiente De Gran Capacidad, Muy Resistente A La Presion . Sello De Goma . Capacidad: 16 Litros;35;35012;220028;278000
EDPFSX-LK20C;Fumigador Mochila Trapp 20L;Fumigador Pulverizador Mochila Trapp Mod Sx Lk20 20 Lts;Ancho 195 Cm . Alto 63 Cm . Largo 465 Cm . Peso 400 Kg;35;35012;249977;315000
EDPFSX-CS5;Fumigador Trapp 5L;Fumigador Pulverizador Trapp Mod Sx Cs5 5 Lts;Ancho 19 Cm . Alto 45 Cm . Largo 19 Cm . Peso 135 Kg;35;35012;92996;118000
UTIG0383700-N;Grill Imusa Ad Talent;Grill Imusa Ad Talent Mod 0383700;Ancho 265 Cm . Alto 8 Cm . Largo 45 Cm . Peso Gr;15;15007;106865;135000
GG-LR813;Grill Tokyo Industrial Lr-813;Grill Tokyo Industrial Mod Lr 813 2Tapas Temp 50N A 300N;Grill Electrico Una Placa, Placa Superior Movil .  Base Y Estructura En Acero Manija Cromada . Lampara Piloto .  Llave De Encendido Y Apagado . Temperatura De 50 A 300 C;36;36001;1815000;2287000
EDGFGR2144P-N;Grillera George Foreman Gr2144;Grillera George Foreman Gr2144 9 Porciones + Adaptador;Es El Aparato De Cocina Que Cambio El Juego De Parrillas Para Siempre Ofrece Parrilladas Rapidas Y Deliciosos Resultados Para Bistec, Hamburguesas, Pollo, Verduras Y Mas La Superficie Inclinada Patentada Ayuda A Eliminar La Grasa Durante La Coccion, Y El Revestimiento AntiadherenteEl Calentamiento Por Contacto Dual De La Parrilla Compacta Acelera La Parrilla Para Obtener Comida En La Mesa En Un Tiempo Record;1;1005;515096;650000
GHP-PR700GN;Hamburguesera Progas Pr-700Gn;Hamburguesera Progas Con Tapa Mod Pr 700Gn;Estructura De Acero Inoxidable Cepillado .  Sistema De Quemadores Tubulares De Cajones  . Alimentacion De Gas En Baja Presion .  Con Media Tapa . Altura: 212 Mm . Profundidad:425 Mm . Largo: 652 Mm;36;36001;585000;738000
HETOKMM257;Heladera Tokyo Magna Hd-350;Heladera Tokyo Magna Blanca Hd 350 Fh 2Puertas;Alimentos Siempre Frescos, Disenho Interior Practico Que Permite Mantener Por Mas Tiempo Las Verduras Y Frutas, Posee Una Alta Resistencia Que Facilita Limpieza . Ancho 585 Cm . Alto 1674 Cm . Largo 605 Cm . Peso 51 Kg;5;5001;2300043;2899000
HETOKMAGNA264;Heladera Tokyo Magna Plus 300;Heladera Tokyo Mod Magna Plus 300 Frio Humedo 2Puertas Blanca;Heladera Tokyo  . Modleo Magna Plus 300  . Frio Humedo  . 2Puertas  . Blanca . Tension Electrica 220 Voltios . Frecuencia Electrica 50 Hertz . Ancho 58 Cm . Alto 167 Cm . Largo 73 Cm . Peso 44400 Gr;5;5001;2099981;2646000
HEWRE80BKDWA;Heladera Whirlpool Big Foot;Heladera Whirlpool Big Foot Wre80Bkdwa 586/573L Evox Frio Seco Panel Touch + Ada;Heladera Whirlpool Big Foot  . Modelo: Wre80Bkdwa 586 573L  . Evox Frio Seco Panel Touch + Ada . Capacidad 586 Litros . Color Inox Color . Ancho 777 Cm . Alto 1905 Cm . Largo 86 Cm . Peso 108000 Gr;5;5001;8950061;11278000
HEWHWRE57BKDWX;Heladera Whirlpool Wre57Bk;Heladera Whirlpool Combi Wre57Bk 480/443L Evox Inverter Frio Seco Panel Touch;" Modos Especiales: Fiesta, Compras, Vacaciones .  Xpert Flow: Mantiene Una Temperatura Homogenea En Toda La Heladera . Turbo Freezer: Permite Enfriar Alimentos Y Bebidas; Y Te Avisa Cuando Estan Listos Para Disfrutarlos . Eficiencia Energetica: A . Turbo Hielo . Medidas: An: 70,1 Cm Alt: 184 Cm Prof: 72,5 Cm";5;5001;7017379;8842000
HEWHWRM45ABDWC;Heladera Whirlpool 400L Bl F C;Heladera Whirlpool Wrm45Ab 400/375L Blanco Frio Seco Panel Touch;La Nueva Generacion De Heladeras Whirlpool Poseen Una Gran Flexibilidad Y Movilidad De Compartimentos Para Mejorar El Almacenamiento Y La Conservacion De Tus Alimentos Y Bebidas Ademas Cuenta Con Varias Funciones Que Haran Tu Dia A Dia Mucho Mas Sencillo .  . Ancho 180 Cm . Alto 652 Cm . Largo 747 Cm . Peso 595000 Gr;5;5001;4050820;5105000
HEWHWRM45AKDWC;Heladera Whirlpool 400L Evox;Heladera Whirlpool Wrm45Ak 400/375L Evox Frio Seco Panel Touch;"Heladera Whirlpool Inox 400 Lts  . Mod: Wrm45Ak  . No Frost Con Freezer, La Combinacion Perfecta Entre Almacenamiento Y Disenho . Frio Seco  . Panel Touch  . Funciones Especiales: Vacaciones   Compras   Fiestas . Espacio Adapt: Estantes Y Bandejas Completamente Flexibles Para Adaptar El Espacio De Guardado A Las Diferentes Necesidades Podras Regularlos Y Realizar Multiples Combinaciones Sin Necesidad De Removerlos . Espacio Fresh: Conserva La Frescura Original De Tus Frutas Y Verduras Toda La Semana Y Evita Que Se Resequen Gracias Al Espacio Fresh . Turbo Freezer: Permite Aumentar La Potencia Del Freezer Por Hasta 3 Horas Para Enfriar Mas Rapido ¨Lo Mejor? Te Avisa Cuando Estan Listos Para Consumirlos . 10 Anhos De Garantia En El Compresor; 3 Anhos De Garantia En La Puerta, Contra Corrosion Y Oxidacion  . Cajon Para Frutas Y Verduras  . Luz Led Interior ";5;5001;4152057;5232000
HEWHWRM54ABDWC;Heladera Whirlpool 426L Bl;Heladera Whirlpool Wrm54Ab 426/400L Blanco Frio Seco Panel Touch;Estantes Y Bandejas Completamente Flexibles Para Adaptar El Espacio De Guardado A Las Diferentes Necesidades Podras Regularlos Y Realizar Multiples Combinaciones Sin Necesidad De Removerlos . Retirar El Hielo Nunca Fue Tan Sencillo Con Este Efectivo Sistema Puedes Hacerlo Con Solo Girar Una Perilla . Conserva La Frescura Original De Tus Frutas Y Verduras Toda La Semana Y Evita Que Se Resequen Gracias Al Espacio Fresco . Funciones Especiales: Vacaciones   Compras   Fiesta . Compartimiento Especial Para Conservar Tus Alimentos A La Temperatura Ideal: Carnes Hasta Por 5 Dias Sin Congelar, Bebidas O Lacteos . Espacio Adapt . Espacio Fresco . Congelar Control . Gira El Hielo;5;5001;4557139;5742000
HEWHWRM54AKDWC;Heladera Whirlpool 426L Evox;Heladera Whirlpool Wrm54Ak 426/400L Evox Frio Seco Panel Touch;Espacio Adapt . Espacio Fresh . Freeze Control . Twist Ice . Funcion Turbo . Control De Temperatura . Dimensiones (Altoxanchoxprof) 184,7 X 62,1 X 74,5 Cm . 3 Estantes De Vidrio Templado . Cajon Para Frutas Y Veduras . Eficiencia Energetica: A .  . ;5;5001;4607791;5806000
HEWHWRM56BB;Heladera Whirlpool 492L Bl;Heladera Whirlpool Wrm56Bb 492/462L Blanco Inverter Frio Seco Panel Touch;Heladera Whirlpool  . Modelo: Wrm56Bb 492 462L  . Color:  . Blanco Inverter Frio Seco  . Panel Touch . Ancho 801 Cm . Alto 194 Cm . Largo 85 Cm . Peso 82000 Gr;5;5001;6495985;8185000
HEWHWRM56BKDWX;Heladera Whirlpool 492L Evox;Heladera Whirlpool Wrm56Bk 492/462L Evox Inverter Frio Seco Panel Touch; . Heladera Whirlpool  . Modelo: Wrm56Bk 492 462L  . Evox Inverter Frio Seco  . Panel Touch . Ancho 801 Cm . Alto 194 Cm . Largo 85 Cm . Peso 82000 Gr;5;5001;6602649;8320000
HEWHWRM57BKDWX;Heladera Whirlpool 530L Evox;Heladera Whirlpool Wrm57Bk 530/500L Evox Inverter Frio Seco Panel Touch;Heladera Whirlpool  . Modelo: Wrm57Bk 530 500L Evox Inverter Frio Seco  . Panel Touch . Ancho 801 Cm . Alto 204 Cm . Largo 85 Cm . Peso 84 Kg;5;5001;7127058;8981000
EDAHKCHA-N;Hervidora Para Mate Arno 17L;Hervidora Para Mate Arno Negra Mod Kcha 2000W 17Lts 220V;Capacidad De 1,7 L . Selector De Temperatura: Ideal Para Preparacion De Mate (Hasta 85   C) Y Otros Preparados (Hasta 100   C) . Apagado Automatico A La Temperatura Seleccionada . Indicador Del Nivel De Agua: Para Siempre Colocar La Medida Ideal . Tapa Con Bloqueo De Seguridad Para Evitar Accidentes . Moderna Y Practica: Con Jarra Portatil Inalambrica, Pudiendo Ser Llevada A Cualquier Lugar;1;1011;263913;333000
EDTHTOK2AZ-N;Hervidora Tokyo 2T 2L;Hervidora Tokyo 2 Temperaturas Azul Y Rojo 2 Lts 1800W 220V/50Hz;Potencia 1800W . Capacidad 2Litros . 2 Opciones De Temperatura . Tapa Con Boton De Temperatura . Luces Indicadores De Funcionamiento . Bese Con Enrollador De Cable Incorporado . Apagado Automatico Segun La Temperatura;1;1011;96614;122000
EDTHTOKVI-N;Hervidora Tokyo Glass Led 17L;Hervidora Tokyo Glass Led 17 Lts 1800W 220V/50Hz;La Hervidora Electrica Tokyo Glass Con Jarra De Vidrio Trasparente Cuenta Con Capacidad De 1,7 Litros . Con Una Potencia De 1800W Es Capaz De Calentar El Agua En Cuestion De Segundos . Tambien Esta Disenhada Para No Causar Ningun Tipo De Incendios, Esto Gracias A Su Sistema De Encendido Manual Y Apagado Automatico;1;1011;136636;173000
EDMILMPX16E;Hidrolavadora Michelin Mpx16E;Hidrolavadora Michelin Mpx16E 1600W /125Bar /Manguera 5M C/ Accesorios;Hidrolavadora Michelin  . Modelo Mpx16E  . 1600W  125Bar  Manguera 5M con Accesorios . La Hidrolavadora Michelin Cuenta Con Un Disenho Compacto, Ocupa Poco Espacio Y Es Muy Facil De Manejar Es Apta Para La Limpieza De Senderos, Parrillas, Chimeneas, Cercas, Bicicletas, Motocicletas Y Coches;35;35013;748792;944000
EDMILMPX19EHDS;Hidrolavadora Michelin Mpx19Eh;Hidrolavadora Michelin Mpx19Ehds 2Vel 1900W /140Bar /Manguera 6M C/ Accesorios;Hidrolavadora Michelin  . Modelo Mpx19Ehds  . 2Vel 1900W  140Bar  Manguera 6M Con Accesorios . La Hidrolavadora Michelin Cuenta Con Un Disenho Compacto, Ocupa Poco Espacio Y Es Muy Facil De Manejar Es Apta Para La Limpieza De Senderos, Parrillas, Chimeneas, Cercas, Bicicletas, Motocicletas Y Coches;35;35013;1352060;1704000
COARFA3530HIXA-N;Horno Elect Ariston Fa3530 66L;Horno Electrico Ariston Fa3530Hixa 66L Inox Multifuncion;Ancho 65 Cm . Alto 67 Cm . Largo 64 Cm . Peso 28400 Gr;15;15002;3199987;4032000
COARFA3540HIXA-N;Horno Elect Ariston Fa3540 66L;Horno Electrico Ariston Fa3540Hixa 66L Inox Digital;Ancho 65 Cm . Alto 67 Cm . Largo 64 Cm . Peso 26300 Gr;15;15002;5130056;6464000
EDAHOFOR4-N;Horno Elect Arno Airfry 40Lts;Horno Electrico Arno Airfry 6 En 1 40Lts + Adaptador;Espacioso, Versatil Y Saludable, Suficientemente Grande Para Asar 2 Pollos Al Mismo Tiempo Y Una Variedad De Recetas Para La Familia . Temporizador De 4 Horas Con Apagado Automatico . Capacidad 40 Litros . Tecnologia Conveccion Airfry .  Distribuye El Aire Caliente Uniformemente;15;15002;989992;1248000
EDXHOX495-N;Horno Elect Moulinex Ox495 60L;Horno Electrico Moulinex Optimo Ox495 60L Negro 2200W;Ancho 489 Cm . Alto 497 Cm . Largo 69 Cm . Peso 161 Kg;15;15002;1330553;1677000
EDTHFOTTIAT;Horno Electrico Tokyo 50L;Horno Electrico Tokyo Fottia300 50L C/Limpia Facil Y Timer 300A?A C/1700W;Mejor Tecnologia Para Preparar Las Mejores Recetas En Tu Hogar .  .  Capacidad Interna De 50 Litros .  Rejilla Y Bandeja Removibles .  Termostato (Control Automatico De Temperatura) .  Timer Sonoro (Control De Tiempo) .  Luz Interna .  Dorador   Grill .  Interior Autolimpiante .  Interior Easy Clean;15;15002;660017;832000
GHT-YXD20;Horno Elect Tokyo Ind Yxd20;Horno Electrico Tokyo Industrial Mod Yxd20 2Bandejas De 40X60 Cms 220V/50Hz;Mod Yxd20 . 2Bandejas De 40X60 Cms . 220V 50Hz;36;36001;4168000;5252000
EDTHEISA-N;Horno Electrico Tokyo Isa 60L;Horno Electrico Tokyo Mod Isa 60Lts Inox;Potencia: 2300W . Temperatura Hasta 240C .  Con Convector . 4 Modos De Coccion .  Frente De Acero Inox Y Tapa De Doble Vidrio . 60 Lts Capacidad . 90 Min Timer . Medidas An 60 Cm Alto 60 Cm Prof 57 Cm;15;15002;1694497;2136000
